{"schema_version":"as1.v1.2","satellite_id":"AS1","platform":"TRADINGVIEW","layout_id":"HORUS_A","observer":"HORUS","code_version":"TBD: current alertVersion","source_profile_code":"CB_BTCUSD_SPOT_20260722_V1","instrument":{"ticker_id":"COINBASE:BTCUSD","venue":"COINBASE","symbol":"BTCUSD","base_asset":"BTC","quote_asset":"USD","asset_class":"CRYPTO","market_type":"SPOT","contract":{"contract_type":"NONE","expiry_kind":"NONE","expiry_time":null,"settlement_asset":"USD","contract_multiplier":null,"continuous_series":false,"adjustment_mode":"NONE","adjustment_applied":false,"roll_state":"NONE","roll_event":false}},"session_hint":{"session_type":"CONTINUOUS_24_7","session_state":"OPEN","is_market_open":true},"timing":{"timeframe":"TBD: timeframe.period","bar_open_time":1785145200000,"bar_close_time":1785148800000,"sent_at":1785148801000},"bar":{"open":100000,"high":100250,"low":99850,"close":100100,"volume":123.45,"volume_unit":"BASE_ASSET","volume_basis":"EXCHANGE_NATIVE"},"packet_type":"BAR_CLOSE_SNAPSHOT","confirmed":true,"quality":{"sensor_quality":"GOOD","valid":true,"flags":[]},"client_event_key":"AS1|HORUS_A|COINBASE:BTCUSD|TBD:timeframe.period|1785148800000|as1.v1.2","payload":{"draft_notice":"Time and OHLCV are illustrative only. Exporter fields remain unimplemented.","direction":"TBD: AL_GENUT_A_DIRECTION","state":"TBD: AL_GENUT_A_STATE","risk":"TBD: AL_GENUT_A_RISK","total_score":"TBD: AL_GENUT_A_TOTAL_SCORE","force_score":"TBD: AL_GENUT_A_FORCE_SCORE","force_fade_score":"TBD: AL_GENUT_A_FORCE_FADE_SCORE","flow_shift":"TBD: AL_GENUT_A_FLOW_SHIFT","gate_state":"TBD: alertBusGateStateA","gate_score":"TBD: alertBusGateScoreA","pressure_index":"TBD: alertBusPressureIndexA","block":"TBD: AL_GENUT_A_BLOCK_FLAG","event_code":"TBD: AL_GENUT_A_EVENT_CODE","next_timeframe_hint":"TBD: alertBusNextTfA","mode_code":"TBD: alertBusModeCodeA","active_component_count":"TBD: AL_GENUT_A_ACTIVE_COUNT"}}
