{"schema_version":"as1.v1.2","satellite_id":"AS1","platform":"TRADINGVIEW","layout_id":"MAAT2","observer":"MAAT2","code_version":"sample-v1.2","source_profile_code":"CB_BTCUSD_SPOT_20260722_V1","instrument":{"ticker_id":"COINBASE:BTCUSD","venue":"COINBASE","symbol":"BTCUSD","base_asset":"BTC","quote_asset":"USD","asset_class":"CRYPTO","market_type":"SPOT","contract":{"contract_type":"NONE","expiry_kind":"NONE","expiry_time":null,"settlement_asset":"USD","contract_multiplier":null,"continuous_series":false,"adjustment_mode":"NONE","adjustment_applied":false,"roll_state":"NONE","roll_event":false}},"session_hint":{"session_type":"CONTINUOUS_24_7","session_state":"OPEN","is_market_open":true},"timing":{"timeframe":"240","bar_open_time":1785134400000,"bar_close_time":1785148800000,"sent_at":1785148801300},"bar":{"open":99900,"high":100250,"low":99700,"close":100100,"volume":456.78,"volume_unit":"BASE_ASSET","volume_basis":"EXCHANGE_NATIVE"},"packet_type":"BAR_CLOSE_SNAPSHOT","confirmed":true,"quality":{"sensor_quality":"LIMITED","valid":true,"flags":["PARTIAL_SOURCE"]},"client_event_key":"AS1|MAAT2|COINBASE:BTCUSD|240|1785148800000|as1.v1.2","payload":{"protagonist_tf_minutes":240,"state":"BALANCED","note":"Illustrative sample values; not live market data."}}
